<?xml version="1.0" encoding="UTF-8" ?>
<beanmaker xmlns="https://schema.beanmaker.org/beanmaker-assets"
           xmlns:xsi="http://www.w3.org/2001/XMLSchema-instance"
           xsi:schemaLocation="https://schema.beanmaker.org/beanmaker-assets ../resources/beanmaker-assets.xsd"
>
    <ssh>
        <host>
            <code>remote1</code>
            <server>remote.server.org</server>
            <user>remuser</user>
            <auth>
                <password>
                    <encrypted>ajsfoafjoajgfajg</encrypted>
                </password>
            </auth>
        </host>
        <host>
            <code>remote2</code>
            <server>remote.server.org</server>
            <user>remuser</user>
            <auth>
                <key>
                    <file>/path/to/file</file>
                    <password>
                        <interactive/>
                    </password>
                </key>
            </auth>
        </host>
    </ssh>
    <databases>
        <database>
            <code>test1</code>
            <type>mysql</type>
            <server>localhost</server>
            <port>3306</port>
            <user>dbuser</user>
            <password>
                <cleartext>abracadabra</cleartext>
            </password>
        </database>
        <database>
            <code>test2</code>
            <type>mysql</type>
            <server>localhost</server>
            <port>4435</port>
            <user>dbuser2</user>
            <password>
                <encrypted>jadofafeiojerioe3094</encrypted>
            </password>
        </database>
        <database>
            <code>test3</code>
            <type>mysql</type>
            <server>localhost</server>
            <port>3306</port>
            <user>dbuser</user>
            <password>
                <cleartext>abracadabra</cleartext>
            </password>
            <ssh code="remote1"/>
        </database>
        <database>
            <code>test3</code>
            <type>mysql</type>
            <server>localhost</server>
            <port>3306</port>
            <user>dbuser</user>
            <password>
                <cleartext>abracadabra</cleartext>
            </password>
            <ssh code="remote2"/>
        </database>
    </databases>
</beanmaker>
